Role,Resume
Data Scientist,"Experienced data scientist with python, scikit-learn, and pytorch knowledge. Skilled in machine learning, statistics, and pandas for data analysis."
Data Scientist,"ML Engineer proficient in deep learning, tensorflow, and sql. Strong background in mathematics and predictive modeling."
Web Developer,"Full stack developer with html, css, and javascript expertise. Proficient in react, node.js, and flask for building responsive web apps."
Web Developer,"Frontend developer skilled in bootstrap, css, and javascript. Experience with django and modern web design principles."
Java Developer,"Java professional with spring boot and hibernate skills. Expert in microservices, maven, and backend development."
Java Developer,"Software engineer with java, jenkins, and sql knowledge. Focused on scalable application architecture and databases."
HR,"Human Resources specialist with recruitment and management experience. Skilled in interviewer, communication, and hris systems."
HR,"HR Manager expert in payroll, onboarding, and employee relations. Strong leadership and communication skills."
